{"protocol_version":"1.0.0","mode":"stateless","skill":"ticket","minimum_python":"3.11","run_dir_policy":"outside_skill_and_repo","requirements":[],"inputs":[{"name":"scope_inputs","kind":"path","required":true,"repeatable":false,"description":"Immutable anchors: task, backend (github with repository, or local with local_store), mode, plus ticket for single or epic with optional override and exclusions for index.","choices":[]},{"name":"issue_json","kind":"path","required":true,"repeatable":false,"description":"Fetched graph snapshot JSON (untrusted GitHub or local data).","choices":[]},{"name":"draft","kind":"path","required":true,"repeatable":false,"description":"Agent-authored scope draft; plan-ready seals .first-four-hours/ticket-scopes/<slug>/ticket-scope.md in the target repository, terminal results return structured output.","choices":[]}],"artifacts":[],"phases":{},"commands":{"run":{"allowed_phases":[],"success_phase":null,"allowed_writes":["{repo_root}/.first-four-hours/ticket-scopes","{repo_root}/.git/info/exclude"],"steps":[{"argv":["{python}","{skill_dir}/scripts/seal_issue_plan.py","--repo-root","{repo_root}","--issue-json","{input.issue_json}","--scope-inputs","{input.scope_inputs}","--draft","{input.draft}"],"repeat":[],"capture_stdout":null,"diagnostics_json":true,"failure":"blocked"}]}}}
