{"protocol_version":"1.0.0","mode":"stateless","skill":"scribe","minimum_python":"3.11","run_dir_policy":"outside_skill_and_repo","requirements":[{"distribution":"jsonschema","specifier":">=4.0"}],"inputs":[{"name":"slug","kind":"string","required":true,"repeatable":false,"description":"Document slug; names the ignored .first-four-hours/document-bundles/<slug>/document-bundle.json support state in the target repository.","choices":[],"required_for":["prepare","write","audit"],"accepted_for":["prepare","write","audit"]},{"name":"document","kind":"path","required":false,"repeatable":false,"description":"The committable document.md deliverable, outside .first-four-hours/document-bundles/.","choices":[],"required_for":["write","audit"],"accepted_for":["write","audit"]}],"artifacts":[],"phases":{},"commands":{"prepare":{"allowed_phases":[],"success_phase":null,"allowed_writes":["{repo_root}/.first-four-hours/document-bundles","{repo_root}/.git/info/exclude"],"steps":[{"argv":["{python}","{skill_dir}/scripts/prepare_bundle_workspace.py","--repo-root","{repo_root}","--slug","{input.slug}"],"repeat":[],"capture_stdout":null,"diagnostics_json":true,"failure":"blocked"}]},"write":{"allowed_phases":[],"success_phase":null,"steps":[{"argv":["{python}","{skill_dir}/scripts/seal_document.py","--repo-root","{repo_root}","--slug","{input.slug}","{input.document}"],"repeat":[],"capture_stdout":null,"diagnostics_json":true,"failure":"blocked"}]},"audit":{"allowed_phases":[],"success_phase":null,"steps":[{"argv":["{python}","{skill_dir}/scripts/audit_document.py","--repo-root","{repo_root}","--slug","{input.slug}","{input.document}"],"repeat":[],"capture_stdout":null,"diagnostics_json":true,"failure":"blocked"}]}}}
