{"protocol_version":"1.0.0","mode":"stateless","skill":"architect","minimum_python":"3.11","run_dir_policy":"outside_skill_and_repo","requirements":[],"inputs":[{"name":"draft","kind":"path","required":true,"repeatable":false,"description":"Agent-authored architecture decision draft; an existing Markdown file outside the installed skill.","choices":[]},{"name":"slug","kind":"string","required":true,"repeatable":false,"description":"Architecture workspace slug; the command seals only ignored .first-four-hours/architectures/<slug>/architecture.md in the target repository.","choices":[]}],"artifacts":[],"phases":{},"commands":{"run":{"allowed_phases":[],"success_phase":null,"allowed_writes":["{repo_root}/.first-four-hours/architectures","{repo_root}/.git/info/exclude"],"steps":[{"argv":["{python}","{skill_dir}/scripts/seal_assessment.py","--repo-root","{repo_root}","--slug","{input.slug}","--format","json","{input.draft}"],"repeat":[],"capture_stdout":null,"diagnostics_json":true,"failure":"blocked"}]}}}
