{"protocol_version":"1.0.0","mode":"stateless","skill":"ideate","minimum_python":"3.11","run_dir_policy":"outside_skill_and_repo","requirements":[],"inputs":[{"name":"draft","kind":"path","required":true,"repeatable":false,"description":"Agent-authored ideation draft.","choices":[]},{"name":"slug","kind":"string","required":true,"repeatable":false,"description":"Ideation workspace slug; the command seals only ignored .first-four-hours/ideations/<slug>/ideation.md in the target repository.","choices":[]}],"artifacts":[],"phases":{},"commands":{"run":{"allowed_phases":[],"success_phase":null,"allowed_writes":["{repo_root}/.first-four-hours/ideations","{repo_root}/.git/info/exclude"],"steps":[{"argv":["{python}","{skill_dir}/scripts/seal_ideation.py","--repo-root","{repo_root}","--draft","{input.draft}","--slug","{input.slug}"],"repeat":[],"capture_stdout":null,"diagnostics_json":true,"failure":"blocked"}]}}}
