{"protocol_version":"1.0.0","mode":"stateless","skill":"diagnose","minimum_python":"3.11","run_dir_policy":"outside_skill_and_repo","requirements":[],"inputs":[{"name":"bundle","kind":"path","required":true,"repeatable":false,"description":"Agent-authored diagnosis bundle; an existing regular JSON file outside the installed skill and target repository.","choices":[]},{"name":"slug","kind":"string","required":true,"repeatable":false,"description":"Diagnosis workspace slug; the command seals only ignored .first-four-hours/diagnoses/<slug>/diagnosis.md in the target repository.","choices":[]}],"artifacts":[],"phases":{},"commands":{"run":{"allowed_phases":[],"success_phase":null,"allowed_writes":["{repo_root}/.first-four-hours/diagnoses","{repo_root}/.git/info/exclude"],"steps":[{"argv":["{python}","{skill_dir}/scripts/seal_diagnosis.py","--repo-root","{repo_root}","--bundle","{input.bundle}","--slug","{input.slug}"],"repeat":[],"capture_stdout":null,"diagnostics_json":true,"failure":"blocked"}]}}}
