{
  "protocol_version": "1.0.0",
  "mode": "stateless",
  "skill": "pr",
  "minimum_python": "3.11",
  "run_dir_policy": "outside_skill_and_repo",
  "requirements": [],
  "inputs": [
    {"name": "runs", "kind": "path", "path_policy": "future", "required": false, "repeatable": false, "description": "Run log (JSON lines) outside the target repository; record appends to it, check and publish read it.", "choices": [], "accepted_for": ["record", "check", "publish"], "required_for": ["record", "check", "publish"]},
    {"name": "arg", "kind": "string", "required": false, "repeatable": true, "description": "One argv element of the verification command to run and record, in order.", "choices": [], "accepted_for": ["record"], "required_for": ["record"]},
    {"name": "draft", "kind": "path", "required": false, "repeatable": false, "description": "Agent-authored PR description draft outside the target repository.", "choices": [], "accepted_for": ["check", "publish"], "required_for": ["check", "publish"]},
    {"name": "base", "kind": "string", "required": false, "repeatable": false, "description": "Git ref of the PR base, such as origin/main; the description covers base...HEAD.", "choices": [], "accepted_for": ["check", "publish"], "required_for": ["check", "publish"]},
    {"name": "title", "kind": "string", "required": false, "repeatable": false, "description": "PR title the user confirmed.", "choices": [], "accepted_for": ["publish"], "required_for": ["publish"]},
    {"name": "confirm", "kind": "string", "required": false, "repeatable": false, "description": "body_sha256 that check reported for the exact draft the user explicitly confirmed.", "choices": [], "accepted_for": ["publish"], "required_for": ["publish"]}
  ],
  "artifacts": [],
  "phases": {},
  "commands": {
    "record": {
      "allowed_phases": [],
      "success_phase": null,
      "allowed_writes": ["{repo_root}", "{input.runs}"],
      "steps": [
        {
          "argv": ["{python}", "{skill_dir}/scripts/record_run.py", "--repo-root", "{repo_root}", "--runs", "{input.runs}"],
          "repeat": [{"input": "arg", "flag": "--arg"}],
          "capture_stdout": null,
          "diagnostics_json": true,
          "failure": "blocked"
        }
      ]
    },
    "check": {
      "allowed_phases": [],
      "success_phase": null,
      "steps": [
        {
          "argv": ["{python}", "{skill_dir}/scripts/check_description.py", "--repo-root", "{repo_root}", "--draft", "{input.draft}", "--runs", "{input.runs}", "--base", "{input.base}"],
          "repeat": [],
          "capture_stdout": null,
          "diagnostics_json": true,
          "failure": "blocked"
        }
      ]
    },
    "publish": {
      "allowed_phases": [],
      "success_phase": null,
      "steps": [
        {
          "argv": ["{python}", "{skill_dir}/scripts/publish_pr.py", "--repo-root", "{repo_root}", "--draft", "{input.draft}", "--runs", "{input.runs}", "--base", "{input.base}", "--title", "{input.title}", "--confirm", "{input.confirm}"],
          "repeat": [],
          "capture_stdout": null,
          "diagnostics_json": true,
          "failure": "blocked"
        }
      ]
    }
  }
}
